join_id,purpose,base_table,joins,output_grain,used_by_insights
J1_order_lines_enriched,"Revenue, demand, product mix, channel, and customer segmentation.",order_items,order_items.order_id -> orders.order_id; order_items.product_id -> products.product_id; orders.customer_id -> customers.customer_id; orders.zip -> geography.zip.,One row per order item line.,"I1, I3, I7"
J2_daily_sales_traffic,"Demand trend, seasonality, and web traffic leading-signal analysis.",sales,sales.Date -> aggregated web_traffic.date after grouping traffic across traffic_source per day.,One row per date.,I2
J3_traffic_source_quality,Traffic-source quality and channel comparison.,web_traffic,Optional date-level comparison to orders.order_date and order_source; keep separate if channel naming does not map cleanly.,One row per date and traffic_source.,I4
J4_returns_enriched,"Return reason, return rate, refund pressure, and product-fit analysis.",returns,returns.product_id -> products.product_id; returns.order_id -> orders.order_id; compare numerator to order_items joined with products for denominator.,One row per return record plus denominator tables by product/category/size.,I5
J5_customer_experience,"Delivery delay, rating, and return-risk analysis.",shipments,shipments.order_id -> orders.order_id; reviews.order_id/product_id -> order/product; returns.order_id/product_id -> order/product; products by product_id.,Order-product level where possible; order level for delay metrics.,I6
J6_inventory_monthly_enriched,"Stockout, fill rate, overstock, reorder, and sell-through operations analysis.",inventory,inventory.product_id -> products.product_id; optionally align inventory year/month with order_lines_enriched order month.,One row per product per month.,"I7, I8"
