priority,insight_id,theme,business_question,tables_used,chart_type,analysis_level
1,I1,Revenue and demand,"Which months, categories, and product segments contribute most to revenue and gross margin growth?","orders, order_items, products",Monthly line chart plus stacked bar by category/segment; optional heatmap for month x category.,"descriptive, diagnostic, prescriptive"
2,I2,Revenue and demand,Do daily sales and web traffic show seasonality or leading signals that can support demand planning?,"sales, web_traffic",Time-series line chart with rolling averages; scatter plot of lagged sessions vs revenue; seasonal decomposition-style month/day summary.,"descriptive, predictive, prescriptive"
3,I3,Customer and channel,"Which order sources, devices, and customer acquisition channels create the strongest order value and repeat behavior?","orders, order_items, customers",Segmented bar chart for AOV and repeat rate; bubble chart for revenue vs repeat rate sized by customers.,"descriptive, diagnostic, prescriptive"
4,I4,Customer and channel,"Which traffic sources produce high engagement versus high bounce, and how does that relate to revenue opportunities?","web_traffic, orders",Traffic-source quality bar chart; trend lines for sessions and bounce rate by source.,"descriptive, diagnostic, prescriptive"
5,I5,Returns and customer experience,"Which categories, sizes, or segments have avoidable return pressure, and what are the main reasons?","returns, order_items, products",Return-rate bar chart by size/category; stacked bar of return reasons; Pareto chart of refund amount.,"descriptive, diagnostic, prescriptive"
6,I6,Returns and customer experience,Does delivery delay or shipping cost relate to lower ratings or higher return risk?,"shipments, reviews, returns, orders, products",Box plot or line chart by delay bucket; dual bar chart for return rate and average rating.,"diagnostic, predictive, prescriptive"
7,I7,Inventory and operations,Which categories or segments suffer from stockouts or low fill rate during high-demand periods?,"inventory, products, order_items, orders",Month x category heatmap for stockout days; scatter plot of fill rate vs revenue; line chart of demand vs stockout days.,"descriptive, diagnostic, predictive, prescriptive"
8,I8,Inventory and operations,Where is overstock tying up capital without enough sell-through?,"inventory, products",Quadrant chart: days_of_supply vs sell_through_rate; bar chart of overstock share by segment.,"diagnostic, prescriptive"
